{
  "contract_version": "2",
  "notice_id": "1721457600000000000-4242",
  "ts": "2026-07-20T04:00:00Z",
  "kind": "deliver",
  "message": {
    "id": "42",
    "from": "Alex Doe <owner@example.com>",
    "subject": "status?",
    "preview": "hey, how is the run going",
    "mailbox": "inbox",
    "task_id": "0f1e2d3c4b5a6978",
    "thread_id": "T-9182",
    "in_reply_to": "<20260719120000.7@example.com>",
    "references": ["<20260718090000.3@example.com>"],
    "sender_standing": "known",
    "provenance": "external",
    "verdict": {
      "auth": "dmarc-pass",
      "screen": "clean",
      "entitlement": "task-counterparty"
    },
    "attachments": [
      {
        "filename": "invoice.pdf",
        "media_type": "application/pdf",
        "size_bytes": 12345,
        "disposition": "unscanned"
      }
    ]
  }
}
